Full Name,Pos,Team,ETA,Rank,FV,Risk,Age,HIT,BAT,PWR,SPD,Report
Bradley Blalock,MIRP,COL,2025,,40,Med,24.3,,,,,"Blalock was selected as a safety pick in the 32nd round of the 2019 draft under the assumption that he was heading to school, but when the ink was dry everywhere else, Boston still had enough bonus pool money left to sign him for $250,000. He had an inconsistent full-season debut in 2021, but also showed significant growth in terms of velocity, sitting 93-95 mph. He entered 2022 as a potential breakout guy, but injuries (TJ and an oblique injury) have impacted large portions of Blalock's last few seasons and his stuff has been more average of late. During that span, he was traded from Boston to Milwaukee (for Luis Urías) and then to Colorado as part of the Nick Mears deal. 
Blalock made his big league debut in 2024 with six starts, most of which came toward the end of the year. His position on the rubber changed a couple times throughout the season, including in his final big league outing. It seems like there's still tinkering happening here. Blalock has a due north arm slot and vertical fastball/breaking ball attack. He has four decent pitches and should be a fine spot starter while he has options left, and then transition to a long relief role when he's out of them."
Roberto Campos,RF,DET,2027,,40,High,21.8,45,45,50,50,"Campos, who signed for $3 million in 2019, is a physical corner outfield prospect with roughly average pull power. He repeated High-A last season and his performance took a substantial leap, from a 98 wRC+ in 2023 to a 120 in 2024. He is so geared to pull that he often swings inside sliders and over the top of changeups, but Campos is a dangerous fastball hitter who looks like a big leaguer in the uniform. His underlying contact data (72% contact rate, 38% hard-hit rate) is in line with the big league average, and it's feasible Campos could play the short side of a corner platoon at maturity."
Connor Thomas,MIRP,MIL,2025,,35+,Low,26.8,,,,,"There was a point when Thomas looked like a lock to be a backend starter, but he pitched out of Memphis’ bullpen in 2024, sometimes covering multiple innings at a time. He worked 90.1 total innings in 56 appearances. Thomas throws both a sinker and four-seamer that sit between 88-91 mph. Neither has plus movement or life, so Thomas fully depends on his impressive command to stop them from getting hammered. His plus-spinning slider, his most-used offering, has above-average length and two-plane shape in the 80-84 mph range. Thomas has robotically consistent command of it and uses it to get looking strikes and as a chase pitch. His cutter also has sharp action and crowds the hands of righty batters. He also throws his changeup to righties but too often that pitch either cuts or sails on Thomas. He has the look of a high-floored sixth to eighth starter but appears slated to play a bulk relief role in his first season with Milwaukee if indeed Thomas sticks."
Angel Guzman,LF,SFG,2028,,35+,Med,19.4,50,50,50,50,"Guzman was in Arizona for extended spring training but went back to the DSL for the summer, where he had an exceptional season in his second tour of duty. He slashed .305/.475/.523 and posted a tremendous combination of contact (85%) and hard-hit (42%) rates. Guzman indeed has an exciting present contact and power blend, but he isn't especially projectable. In terms of build and body comps, we're talking about Robbie Grossman or Gerardo Parra. Guzman's top-hand driven swing covers a lot of the plate and his overall package is seasoned with a pretty good idea of the strike zone. He'll have to hit all the way up the ladder as a likely left fielder, but Guzman is off to a good start."
Erick Brito,SS,PHI,2026,,35+,Med,22.8,55,60,30,50,"Brito is a gamer/grinder infielder with pesky bat-to-ball ability, the sort who tends to be on the 40-man fringe. He's a compact athlete with a very short swing that makes him tough to beat in the strike zone, but what little power Brito has ends up being undercut by his approach, which prioritizes early-count contact. Though he doesn't have ideal shortstop arm strength, Brito's effort level and instincts allow him to make some difficult plays. He's fair at shortstop and above-average at second base. In the Yonny Hernández mold, Brito should play an up/down utility infield role."
Jacob Steinmetz,SP,ARI,2026,,40,High,21.7,,,,,"Steinmetz took a big step forward in 2024. He worked over 100 innings for the first time in his career, his walk rate improved by a huge margin, and his delivery looks more effortless and graceful than ever before. Steinmetz uses a curveball/slider combo right now, but some of his sliders are 87-89 and he might have a sweeper/cutter combination eventually. His curveball has always had good natural depth, but it can be easy to identify out of the hand. Steinmetz has an innings-eater's build and, increasingly, an innings-eater's delivery and control. His stuff isn't monstrous, but it's good enough for him to work at the back of a rotation if he takes another step forward in terms of workload and strike-throwing."
Chalniel Arias,SP,NYY,2028,,40,High,21.6,,,,,"For the last couple of years, the Yankees' rookie affiliates have been full of enormous pitching prospects who make it look like the club is trying to start a basketball team. The broad-shouldered, 6-foot-4-ish Arias is among them. He was promoted from the DSL to the FCL near the end of the 2023 season after he struck out 35 hitters in his first five DSL starts, often working five or six innings at a time, much more than is typical for a rookie ball pitcher. Arias began the 2024 season on the IL with shoulder inflammation, was activated in July, and then made just three regular season appearances. His stuff was up across the board during that window, but it's impossible to tell whether or not Arias will be able to sustain it across an entire season. His downhill fastball averaged 95 mph, up two ticks from 2023, and his slider experienced an even bigger uptick, morphing from an upper-70s offering into one that lived in the 83-87 mph range. His firm, 90-ish mph changeup is still Arias' most-used secondary, and automatic pitch tagging often mistakes it for a sinker. You can dream on Arias' fastball velocity and changeup quality because of his spindly build, relative youth, and the overall fluidity of his mechanics, but he enters 2025 as a very volatile prospect due to his lack of innings."
Gregory Barrios,SS,TBR,2027,,40,Med,21,55,60,30,60,"Barrios was acquired from the Brewers in exchange for Aaron Civale a few weeks before the 2024 trade deadline. He was hitting well at High-A Wisconsin prior to the trade and then went ice cold after it, slashing a combined .288/.342/.367 on the year. Barrios is a twitchy little shortstop who plays a fun and effective style of defense. His first step is incredible, and he has plus range, acrobatic actions, and a surprisingly strong arm for a little guy. He's a very skinny young fellow who projects to play a glove-first utility role in the big leagues. 
There are times when it looks like Barrios is a child swinging a tree branch, but he still finds a way to put the bat on the baseball. He had a 11.7% K% and 83% contact rate on the year, but a lot of that contact was light, oppo spray. Can we project on Barrio's strength? He's only 20 and his measurables for a player that age are average, but he's so thin and frail looking right now that he might be in the ""Carlos Tocci Zone,"" the sort of athlete who struggles to add mass at all. Barrios' excellent defense still gives him a great chance to have a prolonged big league career in the mold of Rey Sanchez and Jack Wilson."
Carlos D. Rodriguez,CF,ATL,2025,,40,Med,24.3,60,60,30,50,"Rodriguez spent the early portion of his career in the Brewers system, projecting as a slash-and-dash fifth outfielder with great bat-to-ball ability and basically no power or plate discipline. In 2024, his last year in Milwaukee's system before electing free agency and joining the Braves on a non-guaranteed big league deal (he was put on the 40-man), C-Rod slashed .284/.368/.374 split between Double- and Triple-A, then played winter ball in Venezuela. To repackage a joke from last year's write-up, Rodriguez's offensive profile is like a serial killer speed dating: lots of slashing, singles only. His 25 extra-base hits in 2024 tied his career high. He can occasionally turn on a down-and-in pitch, but he's generally geared to spray oppo line drives over the head of the shortstop. He is very difficult to make swing-and-miss; Rodriguez ran an 11.8% strikeout rate, a 93% in-zone contact and a 89% overall contact rate in 2024. Two aspects of Rodriguez's game have been in flux for the last year: His speed has dipped a bit as he's filled out, but his selectivity at the plate has improved to roughly average. He still looked fine in center field during winter ball play in Venezuela, and he should provide the Braves with a viable bench outfielder's skill set."
Franco Aleman,SIRP,CLE,2025,,40,Med,24.8,,,,,"Aleman has altered his approach to pitching since leaving Florida (he was at St. John's River and Florida International prior to UF) and is now much more apt to take advantage of the way his fastball plays at the top of the zone. He's also added a couple ticks of velo, averaging 95.7 mph on his fastball the last two years. The size of an NBA wing player at a long-levered 6-foot-6, Aleman also releases the baseball seemingly right on top of hitters. His low-ish slot wreaks havoc on righties' ability to pick up the baseball out of his hand and makes it tough for them to spot his slider. Aleman is a pretty standard fastball/slider middle reliever likely to see big league time either late in 2025 or early in 2026."
Sean Sullivan,MIRP,COL,2026,,40,Low,22.7,,,,,"Sullivan is an ultra-deceptive cross-bodied lefty with 20-grade velocity. He's done well in the mid-minors despite sitting 87 mph because of a mix of deception, command, and quality secondary stuff. Sullivan's stride direction takes him toward the first base line at an extreme angle, and this, in concert with his low three-quarters slot, takes hitters a few looks to get comfortable with. Sullivan's fastball averaged 90 mph in 2023 and 87 mph in 2024, but he still managed a 2.11 ERA, 125 strikeouts and just 15 walks across 115.1 innings, good for a microscopic 3.4% walk rate. In college, Sullivan's repertoire was fastball-heavy in the extreme at about 75% usage. His usage is still really high (67% in 2024), but he's been branching out in pro ball and his changeup generated huge rates of chase and miss last year. His slider plays by virtue of Sullivan's odd release. It's fair to be skeptical that this will actually work in a starting pitcher capacity — asking a guy who sits 87 to navigate a big league lineup three times feels like too much — but in short relief bursts where hitters have no time to adjust to Sullivan's funk, he should be fine."
RJ Petit,SIRP,DET,2025,,40,Med,25.5,,,,,"Try as he might to hide behind a thematically ill-fitting name, short stride and low-three-quarters arm slot, Petit is undeniably enormous. The size gives his running fastball a downhill angle, sapping it of any above-average bat-missing quality despite its mid-to-upper-90s velocity. The shorter stride on a big body can set up Petit’s arm to be late, as he posted a career-worst 11.1% walk rate in 58.2 IP at Double-A last year. But while it’s not a precise operation, Petit has a clear feel for which quadrants to dump his slider and changeup into, and he gets substantial chase on the former.
Petit struck out 31.1% of Double-A hitters with this mix, so it’s getting pretty easy to foresee a good stretch of command carrying him to Detroit. Greater precision and feel with the changeup seems like the best path for graduating to some medium-leverage work when he gets there."
Cristian Hernandez,SS,CHC,2028,,35+,High,21.3,30,20,40,55,"The former $3 million signee repeated Low-A in 2024 and turned in a career year, slashing .269/.382/.406 with 37 extra-base hits and 44 stolen bases in 52 attempts on the season. Most importantly, Hernandez cut his strikeout rate quite a bit compared to his 2022-23 peak, which was up around 30%; he had a 19% rate after a mid-August promotion to South Bend. Hernandez's swing is still really long. It's whippy and powerful, but Hernandez's feet are all over the place and it's tough for him to time his whole operation. It's going to be a big enough issue to prevent Hernandez from being an everyday shortstop, even though he otherwise has the tools to be. Hernandez is an excellent defender capable of highlight reel plays and throws from deep in the hole, he's physically projectable, and he has big bat speed, but at age 21, he's still a very raw hitter."
Colton Gordon,SP,HOU,2025,,35+,Low,26.3,,,,,"Gordon kicked back from Florida to Hillsborough Community College (FL) before bumping back to Division-I ball with Central Florida. He made four starts there before the 2020 shutdown, then his 2021 season for the Knights was cut short by Tommy John. The Astros used a 2021 Day Two pick on him anyway and hustled Gordon up the minor league ladder when he was finally back from his TJ rehab in 2022. He was assigned straight to Double-A Corpus Christi in 2023 and Triple-A Sugar Land in 2024, where he K'd a batter per inning and worked just over 120 innings for the second straight year. While his smoke-and-mirrors deception hasn't played quite as well as it did against A-ball bats, Gordon is still throwing a starter's level of strikes and showing stuff commensurate with a backend starter. Gordon’s four-seam fastball sits between 90-92 mph, but it consistently plays above its pure velocity due to his top-tier extension. His cross-bodied delivery makes him especially tough against lefties. He throws two breaking balls. His curveball is a 1-to-7 shaped offering that often morphs into a slurvey-shaped pitch, while his slider is a shorter sweeper type that shows sharper break. The effectiveness of Gordon’s changeup is driven by his ability to throw the pitch with deceptive arm speed; on pure stuff, it's lacking. Gordon squeezes the most out of his arsenal via deception and unpredictability, and projects to be a spot starter relatively soon."
Marques Johnson,SIRP,SFG,2026,,35+,High,24.7,,,,,"A swingman who finished his career at Long Beach State with some great starts, the Red Sox deployed Johnson solely as a reliever when he turned pro, and he experienced a velo uptick before he was traded to the Giants for Mauricio Llovera. An elbow fracture shelved him for much of 2024, but when he was healthy, Johnson looked the same as he had before surgery. He sits 93-95 with flat angle and cut, and off of that bends in a plus-flashing mid-80s slider with inconsistent shape. So long as he can throw enough strikes, Johnson should be a low-leverage reliever."
Gunnar Hoglund,SP,ATH,2025,,35+,Med,25.3,,,,,"Hoglund threw 130.2 frames between Double- and Triple-A in 2024, posting a 3.58 ERA on the season while striking out 23% of batters and walking just 7%. A former first round draft pick, Hoglund came to Oakland as part of the Matt Chapman trade. He was an east/west fastball/slider guy at Ole Miss, but he's adopted more of a vertical attack since returning from Tommy John. In general, Hoglund has to pitch around his fastball due to its below-average velocity and movement, and he tries to land his slider at the top of the zone for strikes. He has above-average command (not plus — his above-the-zone operation with his fastball makes it tough for Hoglund to work very efficiently), and he does a good job of staying out of the heart of the plate with his heater. The slider remains the headliner of his arsenal, and it has solid spin and two-plane shape, which is especially effective against right-handed hitters. His changeup will also flash average with plenty of depth. Hoglund looks like a strike-throwing depth starter and/or bulk reliever."
Hayden Alvarez,CF,LAA,2031,,35+,High,18,45,45,40,60,"The toolsiest member of the Angels' DSL team, Alvarez is built like a college wide receiver at a ripped 6-foot-3. He's a plus runner with burgeoning raw power that hasn't manifested in games yet due to Alvarez's wonky swing, which isn't in the zone for very long. His early-career chase and contact performance creates an exciting offensive foundation for an up-the-middle prospect whose career is just getting started."
Juan Villavicencio,SS,PHI,2028,,35+,High,20.3,45,45,40,55,"Villavicencio is a punchy little infielder with good power for a hitter his size and enough arm for shortstop. He has experience at several positions already and should be a versatile utilityman down the line. Though he has pretty good power for his age and size, Villavicencio isn't all that projectable and will probably max out with below-average hit and power tools. That's still enough to fit in a bench role so long as you can actually play shortstop."
Luis Mey,SIRP,CIN,2025,,40+,High,23.8,,,,,"Mey had a 2024 Fall League like Abner Uribe's 2023. The wild, inconsistent reliever with upper-90s gas put everything together for six weeks and dominated, allowing just one hit in eight appearances. Mey will touch 102, and his fastball sometimes has enough hair on it to break the bat of the hitter <em>and</em> the guy in the on deck circle at the same time. His best sliders have unhittable wipeout movement. This is late-inning stuff, but Mey has never been able to control it for any length of time and he's run walk rates in the 15-20% range since entering full season ball. He struggles to repeat his release, as if his body is too explosive for its own good. What the entire industry saw in the Fall League was a setup man type of pitcher. Pitchers like Mey sometimes find command in their mid-20s and pitch at the back of a bullpen, at least for a while. Even when it looks like guys like Uribe, or Camilo Doval, or Josh Staumont (there have been a million guys like this) have figured it out, it can be fleeting and leave them just as soon. Expect some feast and famine stretches from Mey."
Christian Cerda,C,ARI,2026,,40,Low,22.3,40,40,40,30,"Cerda came over from Tampa Bay in the 2022 David Peralta trade and reached Double-A for the first time at the end of 2024. He's a fiery on-field leader who has improved on defense during the last several seasons. When the Diamondbacks first got Cerda, he was a pretty awful receiver and ball-blocker, but he's gotten much better at both over the last couple of years. He has great lateral agility whether he's catching on one knee or from a traditional crouch; Cerda uses the latter with runners on base. Cerda has above-average arm strength and below-average arm accuracy right now. He's on track to have a glove-first backup profile because his best offensive skill is his plate discipline. Though his torso rotates like the head of an owl in the batter's box, Cerda hasn't produced much game power. He hasn't been striking out very much, but he lacks deft barrel accuracy and misses a fair bit in the zone. He might strike out more as he accrues upper level reps and opposing arms realize they don't have to nibble to get Cerda out. Young enough to add a little more strength and power, Cerda is tracking like a solid backup."
Juan Matheus,SS,NYY,2028,,40,Med,20.9,55,60,40,55,"Matheus missed most of 2023 with a broken thumb but was still promoted from the DSL to the Tampa complex group for 2024, hitting .321/.429/.488 en route to a late-season promotion to the Low-A affiliate. That slash line is a caricature of Matheus' talent, as he's more likely to be a good utilityman than an impact player, but he's a skilled switch-hitter and versatile defender, talented enough to be a relevant prospect even though he's years from the bigs. 
Matheus fits the ""short, but not small"" prospect archetype, as he is very physical and strong for a hitter his size. He hasn't seemed to lose any of his mobility as a result of beefing up, and he has the speed and range to continue to develop at shortstop. On offense, Matheus tracks pitches very well and guides the barrel all over the zone. He's especially adept at staying on breaking balls and putting those into play even when they're not in the zone. Despite his size and strength, Matheus isn't producing high-end exit velocities right now, and he's physically maxed out, so it's difficult to project that he'll develop much more power down the line. This is what limits his perceived ceiling and has him graded as a likely future utility type, one still several levels away."
Émilien Pitre,2B,TBR,2027,,40,Low,22.5,55,55,40,50,"Raised in a French-speaking suburb of Montreal, Pitre became the fourth-highest drafted Quebecer (Phillippe Aumont, taken 11th overall in 2007, is the highest) when the Rays took him in the second round in 2024. After riding the bench as a freshman, Pitre hit well for two years at Kentucky, with more walks than strikeouts in both seasons and a .301/.420/.519 line as a junior. Like most of college baseball, Pitre enjoyed a huge power uptick in 2024, hitting 10 of his 11 career homers. 
A compact-stroked, contact-oriented second baseman, Pitre has some pull power on the inner third of the plate, but otherwise tends to work the opposite field. He tracks pitches well and gently guides the barrel around the zone, willing to take what's given a lot of the time. Pitre's swing isn't especially athletic; it's very conservative in its style and might benefit from more lower body movement as a means of unlocking power. 
Pitre is a good second base defender who deserves a pro look at shortstop just to see if he can do it. If it turns out he can, it will be a little less important for him to access more power than he currently seems capable of. As a second base-only fit, he has a second-division ceiling. At shortstop, Pitre could be a Joey Wendle type."
Rolddy Munoz,SIRP,ATL,2025,,40,High,25,,,,,"Munoz has one of the better sliders in the minors and has K'd at least a batter per inning every season that he's been in pro ball, including 32.2% of the Double-A hitters he faced in 2024. His 85-89 mph comet slider often has incredible length for how hard it is. Munoz also has one of the bigger gaps in the minor leagues between his fastball's velocity and its effectiveness. His 98-mph heater plays down due to ineffective movement, below-average control, and because Munoz's delivery appears easy for hitters to time. These issues will probably limit his role to the middle innings."
Jack Mahoney,SP,COL,2026,,40,Med,23.6,,,,,"Mahoney played both ways a little bit as an underclassman at SC. He pitched out of the bullpen during most of his freshman year, then missed 2022 recovering from Tommy John, though he was still able to hit some that year. He held 92-94 and touched 96-97 across 17 starts as a junior, and Mahoney was thrown right into the fire from an innings standpoint in 2024, as he worked 120 frames and ended his season in Spokane. It was a very positive campaign for Mahoney even though the Cal League was probably beneath his skill level — he held average velocity all year and walked just 30 guys. His fastball tails, he commands a short, mid-80s slider sitting 84-86 mph, and he has arm-side changeup feel. Mahoney's feel for location is advanced considering his lack of college reps and he has a shot to develop three average pitches. There's a backend starter projection here, with a non-zero chance he's scratching the surface of more."
Michael Massey,SIRP,DET,2026,,40,Med,22,,,,,"Massey spent his freshman season at Tulane before transferring to Wake. He spent his sophomore season in the Demon Deacons' bullpen and was utterly dominant — 76 K, 41.2 innings — in a long relief role. Massey moved into their rotation in 2024 and struggled with walks. Hamstring and back issues shelved him for about a month, and he was put back into the bullpen upon his return. His stuff is still exciting. Massey has a cut/carry fastball up to 96, he added a vertical curveball in 2024 with plus depth in the 77-80 mph range, and his 81-84 mph slider has short glove-side break. Massey could conceivably be developed as a starter in pro ball, but his body and level of mechanical consistency are more typical fits in the bullpen. Here he's projected as a solid middle reliever."
Fernando Cruz,SS,CHC,2030,,35+,High,18.4,40,40,45,60,"Cruz shined in a showcase setting as an amateur and was one of the first top bonus prospects from the 2024 class to be generally known throughout the scouting industry. He signed for $4 million in January 2024 and had a pretty rough DSL debut. He ran a sub-70% contact rate on the year and K'd 27.2% of the time, slashing .215/.326/.329. There's still a great defensive foundation here. Cruz has gorgeous infield footwork and actions, turning the baseball around in the blink of an eye. He can make strong, accurate throws from all kinds of platforms and could eventually be a special defensive player. His swing can be a little noisy and long, something that has plagued a few of Chicago's high-bonus shortstop prospects. Until Cruz shows contact improvement, he slots behind the other, similarly flawed players in the org who are ahead of him on the minor league ladder."
