Full Name,Pos,Team,ETA,Rank,FV,Risk,Age,HIT,BAT,PWR,SPD,Report
Carson Whisenhunt,SP,SFG,2025,95,50,Med,24.4,,,,,"What kind of role can Whisenhunt's all-world changeup carry him to if the rest of his skill set is just okay? Though Whisenhunt has improved in a few key areas, his strike-throwing is still on the fringe of what tends to be viable for a big league starter. His walk rate improved quite a bit in the second half of 2024 (from 12.3% to 9.8%) but was still worse than all but eight major league starters who worked at least 120 innings last year. 
There are other encouraging signs here, though. Whisenhunt held his usual velocity all year even though he exceeded the 100-inning threshold for the first time. He had previously only peaked around 60 innings, first as a college sophomore and then again in an injury-shortened 2023. Whisenhunt's breaking ball, which was once a flaccid curveball, is now a serviceable 82-85 mph slider. Most importantly, he has an elite pitch. His changeup is good in any count — hitters can know it's coming and still be fooled by it. It has generated elite miss rates for multiple seasons, including against Triple-A hitters in 2024. A Devin Williams type of outcome would be plausible for Whisenhunt should he prove unable to start. He stands a good shot to debut late in 2025 and compete for an Opening Day roster spot in 2026."
Luis Morales,SP,ATH,2027,96,50,High,22.5,,,,,"The A's frequently have late-market bonus pool space left to target Asian and Cuban players in the international amateur space, and that enabled them to sign Morales, who they inked for a whopping $3 million. Morales began his A's career in the DSL, but he was so dominant that he was sent to Arizona after just four outings and ended the 2023 season at High-A Lansing having pitched across four different levels. Morales began 2024 in extended spring training with a shoulder impingement before he was sent out at the very end of April. He ended up working 81 innings across 22 starts at High-A Lansing and posted a 4.22 ERA, 24.9% strikeout rate, and 10.7% walk rate. Morales continues to look like an absolutely electric athlete with all-world arm speed, but he's still more a thrower than pitcher. 
The raw material Morales brings to the table is exceptional. He has an ideal pitcher's frame: a broad-shouldered 6-foot-3, tapered at the waist, with oodles of physical projection, like a young Zack Wheeler. His arm speed looks like it should break the sound barrier and produces easy, upper-90s cheese. Morales also has a hellacious two-plane curveball in the 81-84 mph range, and you can go wild projecting on his changeup because of his athleticism and arm speed. 
But Morales' pitchability and on-mound poise need to improve. He works at a breakneck pace that often feels counter productive. He gets the sign from his catcher and lets it rip; he doesn't seem to be executing any kind of plan or competent sequencing, and his command is pretty scattered. Morales and the A's have plenty of time to develop his feel for these things, as his 40-man timeline doesn't start until after the 2026 season. 
Morales has this grade and a reservation on the Top 100 ranking because of his upside, which is considerable. He looks and moves like a top-of-the-rotation starter, and his stuff gives him a late-inning relief floor if he only barely develops as a strike-thrower. Were he a college prospect, Morales would be a top five pick (give or take) in most drafts because of his raw ability. Oakland's track record of optimizing pitchers isn't the best, but scouting and predicting aren't the same thing. Morales isn't racing to the big leagues and is definitely more of a Las Vegas A's prospect than a Sacramento A's prospect, one who will probably spend most of the next couple of years trying to grow and improve as a craftsman. He has a shot to become an All-Star starter down the road."
Noble Meyer,SP,MIA,2027,97,50,High,20.2,,,,,"Ah yes, high school pitchers. Aren't they fun? Meyer hasn't had anything close to his peak high school velocity so far in pro ball, as he sat mostly in the low-90s throughout the 2024 season and struggled badly with walks. Despite this, he was still really hard to hit, and he surrendered just 42 knocks in his 74 innings. I'd argue it's encouraging that even though Meyer's velocity was down from its mid-to-upper-90s peak, nobody could touch his stuff when it was in the zone. Meyer checks nearly every scouting and analytical box. His 6-foot-5 frame is lanky and projectable, his arm works loose and free, he has a lower-than-average release height, and he can create huge action on his secondary pitches. All of these things were still true of Meyer in 2024. His slider and changeup still flashed plus, and he presents a very exciting physical package. Obviously, how Meyer looks in his second full season will be important, but for now, I think it's fair to chalk up his 2024 to the grind and rigors of a pro season, which are simply much different than what the young man experienced in high school."
Xavier Isaac,1B,TBR,2026,98,50,High,21.3,30,20,70,40,"Isaac has some of the most exciting power in pro baseball. A formerly pudgy high school first baseman, Isaac completely reshaped his body, and in a 2023 season spent mostly at Low-A, he became one of the more exciting power-hitting prospects in the sport, as he slugged .521, posted elite peak exit velocities, and struck out at a very reasonable 21.2% clip as a 19-year-old. Isaac had some underlying swing-and-miss issues (a 68% contact rate, lower than all but a couple of big league first basemen), but the guys who succeed in spite of this (the Bryce Harper, Brent Rooker, Kyle Schwarber types) all do so with gargantuan power, which Isaac has. 
Isaac broke camp with the High-A Bowling Green squad in 2024, and was running a 69% contact rate through May before he completely collapsed. By the end of the season, he had a sub-60% contact rate, which is not viable at the big league level. Isaac was getting absolutely worked by pitches in on his hands. His swing is just too long for him to get the bat to that location, and this issue will only get worse as Isaac faces upper-level pitchers who throw harder. There has to be intervention and adjustment here to get Isaac to shorten up, or he won't hit enough to be a big leaguer. His raw power, however, is elite. This is a 21-year-old with 40-homer power who has already made one significant change (his conditioning) as a pro. If Isaac — who has other hitterish elements in his ability to make in-flight adjustments to breaking balls and power fastballs away from him to left field — can get back to being a nearly 70% contact hitter, he's going to be a monster. Even if he can just get into the 65%-ish area, he'll be able to have a Chris Carter-type career. This grade is more about valuing Isaac's ceiling than it is a representation of his current skills. He's Schrödinger's Cleanup Hitter whose early-2025 mechanical look is very important to monitor."
Jeferson Quero,C,MIL,2025,99,50,High,22.5,40,55,55,40,"Quero suffered a torn right labrum diving back to first base in the very first game of the 2024 minor league season and missed the whole year. He was coming off a 2023 spent at Double-A Biloxi during which he slashed .262/.339/.440, doubled his career home run total with 16 bombs, upped his previously concerning walk rate to 10%, and earned a 40-man roster spot. The labrum issue puts Quero's impact arm strength at risk, and we won't know that it's still there until we see him throw again in 2025. He has an ultra-short arm action and was often popping around 1.80 at the end of 2023. The other aspects of Quero's defense need work. He often gets caught in between wanting to block or backhand pitches in the dirt to his right, and Quero is a fairly noisy pitch framer, but overall he's much more advanced than most catchers his age and he probably would have been fine had the Brewers needed him at some point in 2024. 
Quero has a power-over-hit offensive profile and will take some hellacious and wild swings. He gets right on top of the plate and is looking to pull. This approach can leave him vulnerable to stuff on the outer edge, which he sometimes struggles to reach, but so far it has worked for him; Quero has never struck out more than 19% of the time at any minor league level. His contact merics from 2023 — an 85% in-zone contact rate, 75% contact overall — would rank near the middle of the primary catching pack across the last couple of seasons, but Quero is still pretty chase-prone. Even with the uptick in walks in 2023, his swing rates (56-57% the last few seasons) have been way up there with the Mario Felicianos, Francisco Mejías and Jorge Alfaros of the world, predecessors whose monster tools have been severely undercut by their voracious approaches. Yainer Diaz had a rock solid 2022 debut with similar rate stats, and Quero is a better defender than him or Mejía (identical rate contact stats), so his floor should be higher. A big part of Quero's above-average projection comes from his game-changing arm strength, a key component to understand the second he's catching in games again."
Jonny Farmelo,CF,SEA,2028,100,50,High,20.6,45,40,55,70,"Farmelo had the second-fastest 30-yard dash at the 2023 Draft Combine and showed impressive BP power, but his swing was a bit of a mess and seemed to change constantly throughout his high school career. I was relatively low on him prior to the draft, but the Mariners made his swing better pretty quickly after he signed. He still has a lot of extraneous movement in his hands, but Farmelo looked good during backfield activity and then during Modesto's 2023 postseason run. Assigned to Modesto again in 2024, Farmelo was slashing .264/.398/.421 across 221 plate appearances when he blew his ACL while making a slightly awkward catch in the outfield. A typical ACL rehab puts him on the shelf until the middle of the 2025 season. 
It's a developmental blow to a prospect who is much more talented than he is polished. Farmelo can create big power in a short mechanical distance at the dish and he has pretty good bat control, but he still has a bunch of pre-swing movement in his hands that impacts the consistency of both. It's hugely positive that despite this, Farmelo was consistently pulling the ball with power before he got hurt, including fastballs. That's not often the case with hitters this size or who have funky swings. Farmelo has the footspeed to play center field and makes some incredible plays deep in the gap, but he's very raw from a procedural and fundamentals standpoint, things like fielding the ball on the ground and where/how hard to throw the baseball. Farmelo has enormous ceiling as a power/speed center fielder if he can season his defensive ability, and the ACL tear robbed him of reps. 
Farmelo has a big, physical 6-foot-2 frame. His speed is great on its own, but it's absolutely incredible how fast Farmelo is for his size. Whether that's still true on the other side of the ACL tear is also going to have a huge impact on his potential outcomes. This is a rare player who looked like he might have actual five-tool potential, but unfortunately, what was an already risky profile has now seen that risk heightened by severe injury."
River Ryan,SP,LAD,2026,101,50,Med,26.6,,,,,"Ryan was a two-way player at UNC Pembroke and one of the more exciting pitchers on the Padres backfields during their 2021 instructs period, when he hadn't yet pitched in an affiliated game. A plus on-mound athlete with a great arm action and a carrying fastball that was in the 93-95 mph range, he was an exciting, tip-of-the-iceberg dev project for a Padres org that had had recent success with two-way and conversion arms, most prominently Luis Patiño. Then the Dodgers plucked him away in a trade for corner role player Matt Beaty in late March of 2022, and we started to see parts of the iceberg that lay beneath the surface during Ryan's first full season as a pro pitcher. He was more in the 95-97 mph range throughout 2022 and was dominant (if a little wild) across just shy of 50 total innings. In 2023, Ryan held mid-to-upper-90s fastball velo under the stress of twice as many innings. He posted a 3.33 ERA in 97.1 innings with Double-A Tulsa. Shoulder fatigue shelved him for most of the first half of 2024, and though he looked totally fine upon his initial return and made his big league debut at the end of July, he blew out at the end of the season and had Tommy John in August. It will keep him out for the entire 2025 season.
In addition to the plus velocity, healthy Ryan has three plus-flashing breaking balls in a mid-90s cutter, an upper-80s slider, and a mid-80s curveball with late vertical bite. Ideally Ryan will be able to refine his changeup over time; he was using it less than 10% of the time when he blew out, often in even counts. Its results weren't great, but he's a great athlete who is relatively new to pitching, so you can project on that offering. His curveball has enough depth to act as his go-to bat-missing weapon against lefties until his changeup improves. 
The visual report here is pretty ironclad. Ryan's build is a little bit more slight than the prototypical big league starter, but at 6-foot-2, he isn't small. He has sustained premium velocity over 100 innings of work, his breaking balls are plus to the eye and grade out as plus on paper, and while his command isn't great, it's sufficient for Ryan to start and might continue to improve as he gets experience pitching. Ryan was a 55 FV pitcher and looked like one of the better all-around pitcher prospects in baseball before his unfortunately timed TJ added volatility and a prolonged waiting period to his profile."
Ricky Tiedemann,SP,TOR,2026,102,50,High,22.6,,,,,"Tiedemann had a breakout 2022 pro debut during which he climbed all the way to Double-A and, across just shy of 80 innings, struck out 38.9% of hitters and walked just 9.6%. In 2023, vague arm soreness impacted his workload, and then in 2024, Tiedemann was shelved with a shoulder injury early and blew out his UCL not long after returning from the shoulder issue. He had TJ in late July, putting him on track to miss most or all of 2025. 
When he has been healthy, Tiedemann’s stuff has been excellent. He relies heavily on a wicked, mid-to-high-90s four-seamer thrown from a deceptively low lefty arm slot that seems to make hitters in either batter's box uncomfortable. He pairs it with a huge sweeper that has a boatload of horizontal movement, so much in fact that at times it's easy for hitters to lay off of it. Still, it's a great strike-getting weapon because it starts in the lefty batter's box and finishes on the arm-side corner of the plate. Tiedemann's changeup is also pretty good, though more because his command of it has progressed; on pure stuff, it's only fair. He already has two plus pitches and one that pretty comfortably projects to be above average, and even while dealing with arm discomfort in 2023 and 2024, he was able to strike out well over a third of opposing hitters. Aspects of Tiedemann's delivery are unique in a way that makes him look reliever-y, and repeated years of arm trouble add to that risk, but even if he ends up in the bullpen, he's going to be such a dominant reliever that he'll still belong about this high on a prospect list. The 2025 season is Tiedemann's 40-man platform year, and it will be interesting to see whether the Jays deploy him in the AFL or instructs as a means of determining whether or not to roster him, though doing so would expose him to the eyes of rival scouts who might be foaming at the mouth to pop him in the Rule 5 and see what happens."
Kevin Alvarez,1B/LF,HOU,2031,,45+,High,17.2,45,50,60,40,"A 6-foot-4 Cuban outfielder with very exciting left-handed power projection, Alvarez has a big, prototypical corner outfield frame in the Nick Castellanos mold. His hands work with natural loft; he has a traditional low-ball lefty scoop. His lever length creates some hit tool risk, but Alvarez might be able to shorten up as he gets stronger. He's fast enough at time of signing to try center field in pro ball, but realistically (and perhaps ideally) Alvarez will be too big at maturity to play there. A below-average arm limits him to left field if that's the case, but the raw power to clear the bar at that position is going to be here. Potential three- or four-hole hitter with 25-plus bombs."
Braden Montgomery,RF,CHW,2027,,45+,High,22,40,35,60,50,"Montgomery was the 12th pick in the 2024 draft and probably would have gone higher if he hadn't fractured his right ankle sliding into home during the 2024 collegiate postseason. Selected by the Red Sox, he was traded to the Pale Hose as part of the Garrett Crochet swap. Montgomery comes from a family with multiple Division-I athletes and was among the most prominent of the 2021 high schoolers to go to college rather than sign. He spent two seasons at Stanford, where he played both ways and showed meaningful bat-to-ball improvement as a sophomore after a strikeout-prone freshman year. He transferred to Texas A&M for his draft year and was the most talented player on the College World Series runner-up squad. Montgomery slashed .317/.428/.646 throughout his entire college career, with a 20% K% as a junior. 
A super physical 6-foot-2 switch-hitter, Montgomery has monster bat speed from the left side. He has a crouched leg kick, his hands load at a conservative depth, and his hips absolutely explode though contact and help ignite his awesome hack, which has big finish in the dirt behind him. Montgomery’s lefty swing generates power to all fields, and he has some ability to alter his upper body’s posture during his swing in order to clear out the top of the zone, something that he only seemed to develop during his time at A&M. His righty swing is more generic; he has a low-ball tendency from that side and his cut isn’t especially dynamic. He’s vulnerable to changeups as a lefty, and up-and-away fastballs and back-foot breakers as a righty.
Montgomery has a huge arm in right field. He was up to 97 mph as a freshman reliever — his stuff was down during his sophomore year at Stanford and he didn't really pitch at A&M — and, at least before his ankle injury, he had the speed to give center field a try in pro ball. Some of the changes he made at A&M improved the strikeout issues that were once caused by his lever length. This is a switch-hitter who was also a two-way player until 2023, and his performance is even more exciting given that context. Above-average plate discipline and a swing geared to get to his power will help Montgomery overcome what are likely to be elevated strikeout totals. He has the ceiling of a power-hitting right field cleanup batter, but he'll probably be a relatively slow developmental burn for a college player. If the impact of his swing tweaks and speed (and what that does for his potential defensive fit) appear intact upon return, he'll move into the Top 100."
Elian Pena,3B,NYM,2031,,45+,High,17.4,,,,,"Peña is likely to receive the top bonus in the 2025 international class at $5 million, a deal that has been in place since well before David Stearns began to helm the org. Peña has real feel to hit and power despite a relatively squat frame at a stocky 5-foot-11 or so. He has thunderous hands, authoritative to all fields. Peña's swing has big time natural uppercut — at times it has an abbreviated finish, at times it finishes in the dirt behind him a la Ken Griffey Jr. — and it's going to allow him to get to big time in-game power. He has a great chance to have an impact hit/power combination. Peña's a below-average runner and athlete who plays defense with a high center of gravity; he's more of a possible third base fit with first base possibility. A mature build and feel to hit create the possibility that Peña moves quickly through pro ball. He has the talent to be a middle-of-the-order force."
Matt Wilkinson,SP,CLE,2026,,45+,Med,22.3,,,,,"Nicknamed ""Tugboat,"" Wilkinson is a 270-pound lefty who is incredibly athletic for an athlete of his build. His drop-and-drive delivery gets him so low to the ground that his left shin is almost scraping across the top of the mound. His fastball only sits about 90 mph, but it still played like a dominant pitch in 2024 because of its rising action and Wilkinson's ability to command it to effective locations. His sweeper gives him a second above-average offering, while Wilkinson's changeup is still a work in progress. Feasting off his fastball, he was able to strike out 37.6% of opposing hitters in 2024; Wilkinson worked 118.2 innings and allowed just 71 hits. If his changeup takes a step forward, or if Wilkinson starts throwing harder and ends up with an elite fastball, he'll project as a convention-breaking mid-rotation starter."
Cristopher Polanco,SS,TOR,2031,,45,Med,17.2,60,60,40,60,"Polanco is a low-to-the-ground defender with plus feet, hands and actions. His arm strength the lone question on defense; Polanco is otherwise among the best infield defenders in the 2025 international class. He has a smaller frame but is muscular and strong for his size. Polanco's twitchy, and his hands are often in the right place at the right time in the batter's box. A compact athlete with a compact swing, he covers the inner half well. There's a chance for a plus hit tool and shortstop defense here, with Polanco's power likely below average at maturity due to his lack of size."
Yorger Bautista,CF,SEA,2031,,45,High,17.5,60,60,45,60,"Scouts generally like Bautista more than his raw bonus would indicate. He's a twitchy, medium-framed outfielder with explosive hitting hands and wrists, and a swing that has natural loft. Bautista's hit tool is consistently lauded. He has a shot to remain in center field thanks to his speed, though it might depend on how he develops physically. Bautista is a well-rounded center field prospect with a shot to do at least a little bit of everything and be an everyday player."
Matt Koperniak,LF,STL,2025,,45,Med,27.1,45,55,50,55,"Cardinals Devil Magic has returned. Koperniak was about to start his senior season for the Division-III Trinity Bantums when the pandemic hit. Instead he signed as an undrafted free agent and, like a lot of Cardinals batting-gloveless prospects who slip under the radar for a while, he was initially very old for his level but then raced to Double-A. Koperniak has spent the better part of the last two seasons at Triple-A Memphis and he had a power spike in 2024, both in his on-field performance (a career-high 20 homers and 28 doubles) and exit velocities (101 90% average in 2023, 104 in 2024). Koperniak rotates very hard and his best swings are impressively explosive. He has classic low-ball lefty power to his pull side, but for the most part Koperniak does his extra-base damage to the opposite field. Elevated chase rates detract from an otherwise well-rounded offensive profile, enough for Koperniak to be the larger half of a corner outfield platoon."
Austin Peterson,SP,CLE,2026,,45,Low,25.5,,,,,"A 6-foot-6 strike-throwing Leviathan, Peterson has the lowest walk rate (4.3%) among qualified minor league starters since 2022. In 2024 (half at High-A and half at Double-A), Peterson made 27 starts, worked 160 innings, and carried a 2.64 ERA. He generates plus vertical movement on a 90 mph fastball and peppers the top of the zone with that and a couple of different breaking balls. The Guardians have been able to take older, strike-throwing starters and help them throw harder past when one might expect pitchers to start doing that, with Tanner Bibee a prominent recent example. Peterson's size and bodily fluidity make it seem feasible that this could happen for him, but for right now, his stuff lacks the power of a mid-rotation starter, and he's more of an innings-eating no. 4/5."
Andrew Salas,SS,MIA,2031,,45,High,17.1,50,50,45,60,"Salas been among the top players in the 2025 international class for a while, in part because of his siblings (Ethan and Jose), domestic showcase activity, and his family's heavily-scouted baseball training facility. Andrew is a talented, projectable shortstop with a shot to be plus defender. He has experience at shortstop and in center field, including summer 2024 pro ball in Venezuela. He comfortably has the range, actions, and arm to stay at shortstop, and is great around the bag himself and at feeding teammates. On offense, Salas' low-ball swing produces gap-to-gap contact. He might struggle with high fastballs the way Jose did once he got into the mid-minors. Salas has a projectable build; he's 6-foot-3 with broad, sloping shoulders. He should grow into above-average power, but whether his swing is geared to tap into it is another matter. Salas is a potential everyday shortstop whose bonus is likely to approach $4 million."
