Full Name,Pos,Team,ETA,Rank,FV,Risk,Age,HIT,BAT,PWR,SPD,Report
Ryan Waldschmidt,LF,ARI,2027,,45,Med,22.5,40,40,55,60,"Waldschmidt spent his first college season at Charleston Southern playing a mix of third base and outfield, then transferred to Kentucky for his sophomore and junior years and moved full-time to left field, where he remains a speedy work-in-progress. Like a lot of college hitters, he enjoyed a huge uptick in power output in 2024, clubbing 14 homers and doubling his career total in the process. Waldschmidt had an OPS north of 1.000 and performed well in several key statistical categories at Kentucky, including plate discipline, contact, and measurable power. He had one of the more well-rounded statistical cases of any college hitter in the 2024 draft. 
Visual evaluation of Waldschmidt's hit tool comes in south of his data. His swing is hellacious but atypical. He takes a really healthy hack but does so with basically no stride. Waldschmidt's swing is all hands and torso, and requires a ton of effort, so much that his head kicks around and he often loses sight of the baseball as his body ignites. His hardest swings are truly over in the blink of an eye, like a cobra strike — this guy has big time bat speed and power that plays best (by far) against pitches down-and-in. If he can sustain this approach all the way up the minors, we're talking about a LF/DH who's in the lineup every day. The left field-only profile puts Waldschmidt on thin ice if he can't, in which case, we'd be looking at a Clint Frazier type outcome."
Austin Charles,3B,KCR,2028,,45,High,21.4,35,40,55,55,"Charles was the Royals' last pick in 2022 and signed at the 11th hour after visiting the team's facility. He's a physical outlier at a yoked 6-foot-5, and he is an absurdly coordinated defensive player for someone his size. His swing is a little awkward looking, but Charles was still able to post an above-average wRC+ at Low-A in 2024 at age 20. He's so geared to pull that he swings inside a ton of sliders. If he can quell this tendency, he'll click enough to merit upside-driven Top 100 inclusion a year from now."
Lucas Braun,SP,ATL,2027,,45,Low,23.6,,,,,"Braun didn't pitch very much as an underclassman at San Diego, and it took transferring to Northridge for him to find a real role. He signed for just shy of $350,000 as a 2023 sixth rounder, and in 2024, his second season stretched out as a starter, he worked 143.2 innings and spent the second half at Double-A Mississippi. Braun's delivery is like a Dana Carvey impression of Ryan Walker's delivery. He starts on the extreme third base side of the rubber and uses a cross-bodied stride; it isn't identical to Walker's, but it's in the neighborhood. Braun's sweeper is plus and his release point makes it a nightmare for righties to deal with. It also gives the pitch so much space to break horizontally that it plays nicely as a backfoot weapon against lefties. The rest of Braun's repertoire is a little south of average, but he's a good athlete who hasn't been starting for very long, and his changeup should get better as he continues to use it. Braun's ability to locate all of his pitches is remarkable for someone without much starting experience. If his changeup can take a leap, then Braun has a sneaky shot to be on the Top 100 list 12 months from now. For now, he's another surface-scratching pitcher who the Braves have improved enough to forecast as a stable no. 4/5 starter."
Jaden Hamm,SP,DET,2027,,45,Med,22.6,,,,,"Hamm had an incredible first pro season for a small school starter, as he carved up the Midwest League to the tune of a 2.64 ERA. He struck out 122  and posted a 1.05 WHIP in 99 innings, though he tended to work only about four frames per start. It was a gentle increase from the 91.2 innings he threw the season before combined between Middle Tennessee and his post-draft pro spurt. 
Hamm throws strikes with four different pitches but arguably still has some relief risk due to the nature of his delivery, which features a ton of trunk tilt, an atypical look for a workhorse starter. He shares bodily and mechanical characteristics with former Twins prospect, and current Tiger, Jordan Balazovic. The aspect of Hamm's game that stands out immediately is the vertical movement on his fastball. This is a 20-inch induced vertical break guy, though when you adjust for Hamm's release height (higher releases generate more IVB, and Hamm's is six-and-a-half feet) he's not generating elite ride, but he is deceptive and creates really tough angle on this pitch. More impactful is the way Hamm's release allows his curveball to tunnel with his heater. The two are almost indistinguishable from one another on most of their flight paths, before Hamm's low-80s curve suddenly descends into the zone or beneath it. Hamm's curveball generated a 43% miss rate in 2024, one of the better whiff-inducing curveballs in the minors last year. Off of that he'll show you a changeup and a slider/cutter with distinct lateral shape; both of these pitches live in the mid-80s and are about average. 
Though Hamm's stuff probably won't overwhelm big league hitters, he throws strikes, he has a deep repertoire, he's deceptive, and he has now sustained success across about 100 innings for two years in a row. He has more of a multi-inning relief look mechanically, but in all other ways, he's tracking like a stable no. 4/5 starter. "
Jack Neely,SIRP,CHC,2025,,40+,Med,24.8,,,,,"Neely, who came to the Cubs in the Mark Leiter Jr. trade at the 2024 deadline, is a gigantic guy who hopped around to a several schools (Texas, San Jacinto, Iowa Western, Ohio State) before pro ball. He has been developed solely as a reliever and posted double digit strikeouts per 9 IP up the entire minor league ladder, culminating in a 2024 big league debut with the Cubs after the trade. 
Neely is a standard middle relief prospect. He sits 94-98 mph with plus vertical break and nearly perfect backspinning shape even though he releases from more of a three-quarters slot. He also has an 84-88 mph bullet-style slider that generated elite swing-and-miss in the minors last year. If he can ever learn to locate it more consistently, he'll play a higher leverage role."
Reggie Crawford,SIRP,SFG,2027,,40+,Med,24.3,,,,,"A two-way college player, Crawford's draft status peaked during his pre-draft summer, when he was sitting 100 with Team USA and flashing big power on Cape Cod. He got hurt and had Tommy John that fall and missed his entire junior year, but his upside still demanded an early pick and the Giants popped him 30th overall. Crawford was developed as a two-way player through 2023, but he totaled just 19 innings that year and struck out too much for the experiment to continue. In 2024, Crawford was immediately moved into the bullpen, and it felt as though a singular focus on pitching, combined with clearance to air it out, might allow him to reach the bigs fast. For a while, it looked like that was happening. While wild (15.8% BB%), Crawford was overwhelming Double- and Triple-A hitters (38.5% K%) when his velocity suddenly tanked in an outing in early June, and he was shut down. He was sitting 100 on May 26, and 93 on June 5. Crawford had shoulder surgery toward the end of the season, late enough that he'll likely miss most or all of 2025. 
When he's really humming, Crawford looks like a future closer in the José Alvarado mold. He powers sinkers past hitters all over the zone and flashes a ridiculous mid-80s slider. Crawford's delivery is pretty violent, he's a tightly wound, bulky sort of athlete, and he doesn't repeat his release consistently. Even though he has a viable third pitch (his changeup is fine), he was always likely to be a reliever because of these issues. Now he's had two major injuries and surgeries in a span of about two and a half years. It creates volatility and delay that alters the way Crawford is ""valued"" as a prospect even though his <em>evaluation</em> hasn't changed. Hopefully he returns with his pre-injury stuff. If he does, we could see him in San Francisco sometime in 2026."
Kade Morris,MIRP,ATH,2026,,40+,Low,22.8,,,,,"Morris posted a 5.42 ERA in his draft year but was still a shrewd pickup by the Mets because of his relative youth and projectability for a college prospect, as well as his repertoire depth. In 2024, he reached High-A and then was acquired by the A’s in the deadline deal that sent Paul Blackburn to New York. Morris' walk rates to this point feel a bit faulty. He lacks a consistent release point and was walk-prone at Triple-A toward the very end of the season, and this (plus Morris' skinny build) is driving his long relief projection here. But we think Morris will be a premium version of this archetype. He utilizes both a four-seamer and a sinker (his groundball rate spiked after the A's acquired him), with a tendency to throw the four-seamer from a noticeably higher slot than his sinker. Morris' sinker will show above-average movement, his four-seamer has uphill angle that will allow to it play as a finisher if he improves his command of it to the proper location, and his velo was surging at the very end of the year, when he was sitting 94-95 at Las Vegas. His slider is a two-plane breaker, while the curveball is often 20 mph slower than his fastballs and will flash deep 11-to-5 action. He also brings a changeup to the table that sits in 85-88 mph velo range and features both fade and sinking action; it plays especially well off of his sinker. This is a good pitching prospect even if we're not totally convinced Morris is a starter. He's tracking to debut at some point in mid-to-late 2025."
Chris Cortez,SIRP,LAA,2025,,40+,Med,22.5,,,,,"Cortez began 2024 in Texas A&M's rotation, but he quickly shifted into a relief role and thrived. He was incredible during the college postseason and mowed through several SEC lineups in a high-leverage long relief role, likely bolstering his draft stock late in the process. Cortez is a medium-framed guy with below-average athletic projection. He uses a short-striding, cross-bodied delivery with a low three-quarters slot, which causes his fastball to move and play like that of Justin Martinez of the Diamondbacks. Cortez can pump upper-90s gas with heavy sink across multiple innings. His upper-80s slider has curveball shape when he lands it in the zone, and more sweeper-style movement when it's on the glove-side part of the plate. He threw a handful of changeups in 2024, but he's mostly just a two-pitch guy — perhaps like Martinez, he is a candidate to add a splitter in pro ball. Cortez projects as a quick-moving, impact reliever who'd be the third-best bullpen arm on a good team."
Ben Hess,SP,NYY,2027,,40+,Med,22.6,,,,,"Hess was a three-year starter at 'Bama but was limited to just 30 career starts due to injuries, and he posted a 5.80 ERA as a junior largely because of elevated walk rates. He kept his walks under control as a sophomore, but not in his other two seasons, and his pre-draft grade was heavily influenced by this issue. Hess is a softer-bodied guy, but he's fairly athletic, especially for his size. One could argue he has ""reverse projection,"" meaning that if he and the Yankees can improve his conditioning, it's plausible Hess' stuff and/or command will improve even though on the surface he looks like a maxed-out older guy. 
Hess' fastball topped out at 98 mph in 2024 and averaged 94 mph across the entire season, though it yo-yo'd toward the end. He was up for his SEC tournament game versus LSU (94-96 mph), and then down for his final two starts (92-94 mph). Hess' size helps him create plus extension, and his fastball has rise/run shape. His monster mid-70s curveball, which generated a miss rate north of 50% in 2024, is Hess' nastiest pitch right now. He also has a distinct mid-80s slider, but he lacks feel for breaking ball release and scatters the location of both, especially as far as the slider is concerned. Hess is definitely more of a dev project than most big program starters, but one could argue there's meat on the bone here because he has missed so much time with injury. That said, one could also argue that those injuries make it tough to buy that Hess will sit 94 when he's healthy enough to throw 120 innings. Hess performed like a guy with a ton of relief risk prior to the draft, but the Yankees' ability to develop pitching gives him more ceiling than that."
Robert Calaz,RF,COL,2029,,40+,Med,19.4,30,40,55,40,"Calaz had among the best present raw power in the 2023 international signing class and he has reinforced that assessment so far in pro ball, as he has 19 homers in 105 career games and has posted peak exit velocities (113 mph max, 109 EV90) that would be plus on the big league scale, let alone for a teenage hitter. He clubbed his way off the complex in 2024, spending the final three weeks of the season at Low-A Fresno, and is now a career .336/.436/.603 hitter with 54 extra-base hits in 105 mostly rookie-level games. 
The power aspect of Calaz's profile is for real. Perhaps what is most absurd is how much thump he can generate without a leg kick — he starts with a very wide stance and uses just a little toe tap to get going. A very loose athlete, Calaz rotates with verve and ferocity, but in order to do so, his hips often clear very early, leaving him vulnerable to sliders away from him. This is a pretty serious issue already. Calaz ran a paltry 66% contact rate in 2024, worse than all but one qualified big leaguer (Zack Gelof). There are a handful of very toolsy whiff-prone power hitters in that contact rate area, including Christopher Morel and Logan O'Hoppe, both of whom are sound build/frame comps for Calaz. And Calaz projects to have raw power similar to other players in that group, like Brent Rooker and Adolis García. There's 35-homer ceiling here, but there's also a lot of bust risk because of how many rookie-level strikeouts we're talking about."
PJ Morlando,LF,MIA,2029,,40+,High,19.9,50,50,70,45,"Morlando had the best present power among the high schoolers in the 2024 draft. It's titanic left-handed pop, absurd BP power for a hitter his age; he has made big league parks look small with a wood bat. A strapping, big-framed lefty power bat, he's capable of crushing belt-high fastballs at high school velocities. His long, bottom-hand dominant swing could be vulnerable to Ks against pro velo, but Morlando's 79% contact rate on the showcase circuit was rather encouraging. He doesn't utilize a stride in the box in an attempt to stay compact, but it robs him of athleticism and rhythm, and he might be really late on pro fastballs if it stays this way. The power potential here is massive — Morlando has 30-homer raw in there — it's just not totally clear yet how much of it he'll get to in games because his hit tool is more volatile than his high school showcase contact performance indicates."
Griffin Burkholder,CF,PHI,2029,,40,High,19.6,40,45,50,70,"Burkholder, who ranked 70th on the 2024 Draft Board, was signed away from a West Virginia commitment for $2.5 million in the second round. He's a long-levered speedster whose swing has tended to be on time to pull the baseball even though Burkholder is a lankier guy. Per Synergy Sports, he ran a roughly 73% contact rate on the showcase circuit, which is just south of the big league average. Burkholder's hitting hands fire a little late, but they work well; they're snappy through contact and give him surprising pop for someone his age who is as sinewy as he is. Right now, that manifests as gap-doubles power, and there might be more thump on the way via added strength and perhaps even a tweak to his mechanics. There is currently very little happening with Burkholder's lower body during his swing, and he could stand to have a more athletic cut and see what kind of power arrives. 
Burkholder easily has the speed to play center field, but his balls skills are middling. The likelihood that Burkholder and Dante Nori, who is more obviously a center field fit, traverse the minors together will probably mean they split reps out there, with Nori taking the bigger piece of chicken. Burkholder has the foundation of a part-time outfield prospect, with more offensive upside than that if his frame and swing develop in a meaningful way."
Joe Rock,SP,TBR,2025,,45,Low,24.7,,,,,"Rock is a very deceptive lefty with roughly average stuff and plus control. Though his pitches don't look like they move a ton, Rock still generates average or better chase across his entire repertoire, which consists of a sinker, changeup, slider, and elevated four-seamer. Rock has a small forward's build at a lanky 6-foot-6, and his delivery has an enormous glove raise, during which his shoulder blades nearly touch as Rock's arm action swoops behind him. He looks like a prehistoric bird at the moment he's most splayed out. As elaborate as this looks, Rock is still able to throw a ton of strikes.  He throws both a two- and four-seam fastball; he utilizes the former down in the zone with its tailing action, while he’ll sneak the latter up above hitters' barrels with the aid of the unique angle his release point creates. He sits 91-94 mph with both heaters and, with his frame as thin and long as it is, could easily add a tick more velocity as his body adds strength. The slider is a three-quarters breaking ball in the 83-86 mph range that has late tilt to it, but varying degrees of depth. His 85-87 mph changeup is in the same velo neighborhood as his slider and has fade and sinking action at its best. Rock consistently sells it with fastball arm speed. Rock has shown improvement in his overall strike-throwing ability, but his precision projects to be a tick below average. His arsenal is sufficient to carry a back-of-the-rotation role in the near future, and he has better long-term projection than most 23-year-olds because of his frame. He worked 140 innings in 2024 and is primed to compete for a spot at the back of the Rays rotation in 2025."
Owen Hall,SP,DET,2029,,45,High,19.4,,,,,"A prototypical high school pitching prospect, Hall ranked 32nd on the 2024 Draft Board due largely to his projectable build and breaking ball quality. It only took a modest $1.75 million to sign him away from a Vanderbilt commitment. 
Hall is a skinny 6-foot-3 righty with a condor's wingspan whose fastball velocity was pretty variable during pre-draft looks; he was up to 97 the summer before his draft year but sat 92-94 at times. He works with a high-three-quarters arm slot, but a more vertical hand position on release creates playable riding action on his heater despite its downhill plane. Hall also hides the ball well; his arm action is efficient and should become more consistent as he matures and improves his release consistency. Though Hall often struggles to finish his breaking balls below the zone, both pitches — an upper-70s curve and a low-80s slider — have aesthetically pleasing shape and depth and could be plus if they're thrown harder as Hall's frame fills out. We also have optimism surrounding Hall's changeup projection because of his arm speed and action. Hall is a high-variance project with mid-rotation ceiling. His FV is a shade higher than most prep pitchers who get shy of $2 million."
Jaxon Wiggins,SIRP,CHC,2026,,40+,High,23.5,,,,,"Wiggins was a lights out reliever as a freshman at Arkansas and looked like a potential future top 15 pick, but he struggled as a sophomore when he was moved into the rotation. Then Wiggins' elbow barked and he had Tommy John not long before the start of the 2023 season, his draft year. He already had significant relief risk prior to the injury and this pushed things a little further in that direction. The Cubs took him in the second round and gave him $1.4 million, and Wiggins rehabbed until May of 2024, when he finally got into actual games again. The Cubs quickly shuttled him to High-A and he was dominant at the very end of the season, striking out 17 and allowing just four hits in his final 10 innings. 
Wiggins' rangy 6-foot-6 frame offers substantial projectability and creates a downhill angle on his 96-98 mph fastball. He lacks refined command, but his fastball really holds its plane through the zone and it doesn’t require pinpoint precision in order to be effective. His slider is a mid-80s two-plane breaker with significant depth, but Wiggins is very reliant on chase and only threw it in the zone 31% of the time last season; seasoned hitters might not be as apt to fish for it as A-ballers. His mid-80s changeup took a step forward in 2024 and generated a 42% in-zone whiff rate due to its late vertical depth and Wiggins' ability to mirror his fastball arm speed. There's enough here to justify a stater development track, though we still think the most likely outcome for Wiggins will be a late-inning relief role."
Yordin Chalas,SIRP,ARI,2027,,40+,High,21.2,,,,,"Chalas is a projectable relief prospect who quickly moved from the DSL to the Arizona complex in 2023, and then was pushed pretty aggressively again from Low-A Visalia to High-A Hillsboro in 2024. He is forecast here as a late-inning weapon. 
Chalas is already reaching back for upper-90s heat at 20 years old, he's lanky and projectable, and he's a visually explosive athlete with very powerful and exciting mechanics. He takes a huge stride directly at the plate, he generates big hip and shoulder separation, his arm action looks fluid and natural even though it's relatively curt, and he's balanced over his landing leg throughout his delivery. Though its shape limits its bat-missing utility to the high-and-arm-side quadrant, Chalas has pretty good feel for living in that area; he's going to have a monster fastball at maturity, maybe even an elite one. As soon as Chalas' slider feel clicks, he's going to race to the big leagues. Right now, he struggles to get depth on the pitch (82-86 mph, up to 88 — again, a pitch that we anticipate will have plus velocity at peak), which is common for young pitchers with a lower arm slot like Chalas. In 2025, signs that he has either made any kind of progress or has been tinkering in this area are key variables to monitor. 
His slider is far enough behind that it's the main thing keeping Chalas from having a slam dunk setup man grade here. He'll be able to live off his fastball alone in a meaningful relief role, but a high-leverage job is plausible if any kind of secondary pitch emerges for him."
Chen-Wei Lin,SP,STL,2028,,40+,High,23.4,,,,,"Lin was a notable Taiwanese college pitcher who gained stateside exposure via the Northwoods and MLB Draft Leagues before he signed with the Cardinals for $500,000 in 2023. He pitched a little bit on the Jupiter complex and in A-ball that year, and was very walk-prone. Sent back to Low-A Palm Beach in 2024, Lin's stuff overwhelmed hitters, and he had a great season — 116 innings, 9.54 K/9, 2.79 BB/9, 2.79 ERA — despite still being mechanically inconsistent. His fastball touched 100 several times throughout the season and sat 94-97 for most of the year, and though Lin's velocity tapered a little bit late in the season, he was still a healthy 93-96 in August. 
Lin's skyscraping, 6-foot-7 frame is still nowhere near filled out, and he remains projectable even at age 23. Added strength doesn't need to yield any more velocity, but stamina and body control would be nice. Lin's changeup projects to be his best secondary pitch. It tends to live in the upper-80s and Lin's feel for locating it to his arm side is precocious, but his ability to create bat-missing movement on each one is not. His best ones are plus, and the pitch projects to mature there. The direction of Lin's slider also varies, and that pitch has low-end raw spin, regularly registering under 2,000 rpm. Yes, Lin is 23 and has only pitched at Low-A, but he's now proven he can hold above-average velocity across a lot of innings, and he performed despite being fairly raw. He still has two full seasons left before the Cardinals have to put him on the 40-man, which is plenty of time for him to stretch out to 150 innings or so, and climb a level per year so that he's comfortably in position for an add after 2026. This is a high-ceiling pitching prospect who exceeded expectations in his first pro season and has a shot to be a mid-rotation starter down the line."
Grant Holman,SIRP,ATH,2025,,40+,Med,24.8,,,,,"A two-way player as an underclassman at Cal, Holman transitioned to pitching (as a starter) full-time during his junior year. He enjoyed a velo spike as he was moved to the bullpen in pro ball. Holman is a three-pitch reliever. In 2024, he accumulated 15.2 innings of work at the big league level, where he struck out 16 and walked nine largely working in bursts of one inning or less. He sits 93-95 and hurls his gigantic frame directly at the plate, enabling him to bully the zone with average velocity but plus extension. Both of his secondary pitches are capable of missing bats, and at times, his slider has very impressive two-plane movement for a pitch that bends in around 87 mph. Still, Holman's changeup is his most consistent and dangerous offering, and he racked up a 39.6% swing-and-miss rate on the nearly 100 of them he threw to major league hitters last season. The pitch has bat-missing sink, and Holman tends to command it to enticing locations. His ability to attack hitters of either handedness separates Holman from the generic middle relief group in the 40 FV tier. He has a shot to be a more important bullpen cog behind Mason Miller, perhaps even the Athletics' setup man."
